No.     Time           Source                Destination           Protocol Length Info
      1 0.000000000    192.168.0.101         216.58.220.46         TLSv1.2  55     Continuation Data

Frame 1: 55 bytes on wire (440 bits), 55 bytes captured (440 bits)
Ethernet II, Src: HonHaiPr_01:2f:21 (2c:33:7a:01:2f:21), Dst: D-LinkIn_46:a3:e6 (bc:f6:85:46:a3:e6)
Internet Protocol Version 4, Src: 192.168.0.101 (192.168.0.101), Dst: 216.58.220.46 (216.58.220.46)
Transmission Control Protocol, Src Port: 50487 (50487), Dst Port: 443 (443), Seq: 1, Ack: 1, Len: 1
Secure Sockets Layer

No.     Time           Source                Destination           Protocol Length Info
      2 0.010064000    216.58.220.46         192.168.0.101         TCP      66     443→50487 [ACK] Seq=1 Ack=2 Win=387 Len=0 SLE=1 SRE=2

Frame 2: 66 bytes on wire (528 bits), 66 bytes captured (528 bits)
Ethernet II, Src: D-LinkIn_46:a3:e6 (bc:f6:85:46:a3:e6), Dst: HonHaiPr_01:2f:21 (2c:33:7a:01:2f:21)
Internet Protocol Version 4, Src: 216.58.220.46 (216.58.220.46), Dst: 192.168.0.101 (192.168.0.101)
Transmission Control Protocol, Src Port: 443 (443), Dst Port: 50487 (50487), Seq: 1, Ack: 2, Len: 0

No.     Time           Source                Destination           Protocol Length Info
      3 0.191716000    74.125.200.189        192.168.0.101         QUIC     83     CID: 0, Seq: 64

Frame 3: 83 bytes on wire (664 bits), 83 bytes captured (664 bits)
Ethernet II, Src: D-LinkIn_46:a3:e6 (bc:f6:85:46:a3:e6), Dst: HonHaiPr_01:2f:21 (2c:33:7a:01:2f:21)
Internet Protocol Version 4, Src: 74.125.200.189 (74.125.200.189), Dst: 192.168.0.101 (192.168.0.101)
User Datagram Protocol, Src Port: 443 (443), Dst Port: 55655 (55655)
QUIC (Quick UDP Internet Connections)

No.     Time           Source                Destination           Protocol Length Info
      4 0.215008000    192.168.0.101         74.125.200.189        QUIC     83     CID: 4150682161231207588, Seq: 42

Frame 4: 83 bytes on wire (664 bits), 83 bytes captured (664 bits)
Ethernet II, Src: HonHaiPr_01:2f:21 (2c:33:7a:01:2f:21), Dst: D-LinkIn_46:a3:e6 (bc:f6:85:46:a3:e6)
Internet Protocol Version 4, Src: 192.168.0.101 (192.168.0.101), Dst: 74.125.200.189 (74.125.200.189)
User Datagram Protocol, Src Port: 55655 (55655), Dst Port: 443 (443)
QUIC (Quick UDP Internet Connections)

No.     Time           Source                Destination           Protocol Length Info
      5 2.441792000    108.160.165.33        192.168.0.101         TLSv1    379    Application Data

Frame 5: 379 bytes on wire (3032 bits), 379 bytes captured (3032 bits)
Ethernet II, Src: D-LinkIn_46:a3:e6 (bc:f6:85:46:a3:e6), Dst: HonHaiPr_01:2f:21 (2c:33:7a:01:2f:21)
Internet Protocol Version 4, Src: 108.160.165.33 (108.160.165.33), Dst: 192.168.0.101 (192.168.0.101)
Transmission Control Protocol, Src Port: 443 (443), Dst Port: 50363 (50363), Seq: 1, Ack: 1, Len: 325
Secure Sockets Layer

No.     Time           Source                Destination           Protocol Length Info
      6 2.448573000    192.168.0.101         108.160.165.33        TLSv1    432    Application Data, Application Data

Frame 6: 432 bytes on wire (3456 bits), 432 bytes captured (3456 bits)
Ethernet II, Src: HonHaiPr_01:2f:21 (2c:33:7a:01:2f:21), Dst: D-LinkIn_46:a3:e6 (bc:f6:85:46:a3:e6)
Internet Protocol Version 4, Src: 192.168.0.101 (192.168.0.101), Dst: 108.160.165.33 (108.160.165.33)
Transmission Control Protocol, Src Port: 50363 (50363), Dst Port: 443 (443), Seq: 1, Ack: 326, Len: 378
Secure Sockets Layer

No.     Time           Source                Destination           Protocol Length Info
      7 2.701572000    108.160.165.33        192.168.0.101         TCP      54     443→50363 [ACK] Seq=326 Ack=379 Win=83 Len=0

Frame 7: 54 bytes on wire (432 bits), 54 bytes captured (432 bits)
Ethernet II, Src: D-LinkIn_46:a3:e6 (bc:f6:85:46:a3:e6), Dst: HonHaiPr_01:2f:21 (2c:33:7a:01:2f:21)
Internet Protocol Version 4, Src: 108.160.165.33 (108.160.165.33), Dst: 192.168.0.101 (192.168.0.101)
Transmission Control Protocol, Src Port: 443 (443), Dst Port: 50363 (50363), Seq: 326, Ack: 379, Len: 0

No.     Time           Source                Destination           Protocol Length Info
      8 5.292287000    192.168.0.100         224.0.0.251           MDNS     103    Standard query 0x0000  PTR _FAE9A5F2._sub._googlecast._tcp.local, "QM" question PTR _googlecast._tcp.local, "QM" question

Frame 8: 103 bytes on wire (824 bits), 103 bytes captured (824 bits)
Ethernet II, Src: XiaomiIn_09:3e:bb (18:59:36:09:3e:bb), Dst: IPv4mcast_fb (01:00:5e:00:00:fb)
Internet Protocol Version 4, Src: 192.168.0.100 (192.168.0.100), Dst: 224.0.0.251 (224.0.0.251)
User Datagram Protocol, Src Port: 5353 (5353), Dst Port: 5353 (5353)
Domain Name System (query)

No.     Time           Source                Destination           Protocol Length Info
      9 15.189334000   192.168.0.101         74.125.200.189        QUIC     66     CID: 4150682161231207588, Seq: 43

Frame 9: 66 bytes on wire (528 bits), 66 bytes captured (528 bits)
Ethernet II, Src: HonHaiPr_01:2f:21 (2c:33:7a:01:2f:21), Dst: D-LinkIn_46:a3:e6 (bc:f6:85:46:a3:e6)
Internet Protocol Version 4, Src: 192.168.0.101 (192.168.0.101), Dst: 74.125.200.189 (74.125.200.189)
User Datagram Protocol, Src Port: 55655 (55655), Dst Port: 443 (443)
QUIC (Quick UDP Internet Connections)

No.     Time           Source                Destination           Protocol Length Info
     10 15.257296000   74.125.200.189        192.168.0.101         QUIC     75     CID: 0, Seq: 65

Frame 10: 75 bytes on wire (600 bits), 75 bytes captured (600 bits)
Ethernet II, Src: D-LinkIn_46:a3:e6 (bc:f6:85:46:a3:e6), Dst: HonHaiPr_01:2f:21 (2c:33:7a:01:2f:21)
Internet Protocol Version 4, Src: 74.125.200.189 (74.125.200.189), Dst: 192.168.0.101 (192.168.0.101)
User Datagram Protocol, Src Port: 443 (443), Dst Port: 55655 (55655)
QUIC (Quick UDP Internet Connections)

No.     Time           Source                Destination           Protocol Length Info
     11 16.275832000   108.162.232.198       192.168.0.101         TCP      54     80→50497 [FIN, ACK] Seq=1 Ack=1 Win=29480 Len=0

Frame 11: 54 bytes on wire (432 bits), 54 bytes captured (432 bits)
Ethernet II, Src: D-LinkIn_46:a3:e6 (bc:f6:85:46:a3:e6), Dst: HonHaiPr_01:2f:21 (2c:33:7a:01:2f:21)
Internet Protocol Version 4, Src: 108.162.232.198 (108.162.232.198), Dst: 192.168.0.101 (192.168.0.101)
Transmission Control Protocol, Src Port: 80 (80), Dst Port: 50497 (50497), Seq: 1, Ack: 1, Len: 0

No.     Time           Source                Destination           Protocol Length Info
     12 16.276204000   192.168.0.101         108.162.232.198       TCP      54     50497→80 [ACK] Seq=1 Ack=2 Win=16616 Len=0

Frame 12: 54 bytes on wire (432 bits), 54 bytes captured (432 bits)
Ethernet II, Src: HonHaiPr_01:2f:21 (2c:33:7a:01:2f:21), Dst: D-LinkIn_46:a3:e6 (bc:f6:85:46:a3:e6)
Internet Protocol Version 4, Src: 192.168.0.101 (192.168.0.101), Dst: 108.162.232.198 (108.162.232.198)
Transmission Control Protocol, Src Port: 50497 (50497), Dst Port: 80 (80), Seq: 1, Ack: 2, Len: 0

No.     Time           Source                Destination           Protocol Length Info
     13 16.276466000   192.168.0.101         108.162.232.198       TCP      54     50497→80 [FIN, ACK] Seq=1 Ack=2 Win=16616 Len=0

Frame 13: 54 bytes on wire (432 bits), 54 bytes captured (432 bits)
Ethernet II, Src: HonHaiPr_01:2f:21 (2c:33:7a:01:2f:21), Dst: D-LinkIn_46:a3:e6 (bc:f6:85:46:a3:e6)
Internet Protocol Version 4, Src: 192.168.0.101 (192.168.0.101), Dst: 108.162.232.198 (108.162.232.198)
Transmission Control Protocol, Src Port: 50497 (50497), Dst Port: 80 (80), Seq: 1, Ack: 2, Len: 0

No.     Time           Source                Destination           Protocol Length Info
     14 16.279495000   108.162.232.198       192.168.0.101         TCP      54     80→50497 [ACK] Seq=2 Ack=2 Win=29480 Len=0

Frame 14: 54 bytes on wire (432 bits), 54 bytes captured (432 bits)
Ethernet II, Src: D-LinkIn_46:a3:e6 (bc:f6:85:46:a3:e6), Dst: HonHaiPr_01:2f:21 (2c:33:7a:01:2f:21)
Internet Protocol Version 4, Src: 108.162.232.198 (108.162.232.198), Dst: 192.168.0.101 (192.168.0.101)
Transmission Control Protocol, Src Port: 80 (80), Dst Port: 50497 (50497), Seq: 2, Ack: 2, Len: 0

No.     Time           Source                Destination           Protocol Length Info
     15 21.270760000   D-LinkIn_46:a3:e6     HonHaiPr_01:2f:21     ARP      42     Who has 192.168.0.101?  Tell 192.168.0.1

Frame 15: 42 bytes on wire (336 bits), 42 bytes captured (336 bits)
Ethernet II, Src: D-LinkIn_46:a3:e6 (bc:f6:85:46:a3:e6), Dst: HonHaiPr_01:2f:21 (2c:33:7a:01:2f:21)
Address Resolution Protocol (request)

No.     Time           Source                Destination           Protocol Length Info
     16 21.270815000   HonHaiPr_01:2f:21     D-LinkIn_46:a3:e6     ARP      42     192.168.0.101 is at 2c:33:7a:01:2f:21

Frame 16: 42 bytes on wire (336 bits), 42 bytes captured (336 bits)
Ethernet II, Src: HonHaiPr_01:2f:21 (2c:33:7a:01:2f:21), Dst: D-LinkIn_46:a3:e6 (bc:f6:85:46:a3:e6)
Address Resolution Protocol (reply)

No.     Time           Source                Destination           Protocol Length Info
     17 23.379214000   192.168.0.101         216.58.220.37         SSL      55     Continuation Data

Frame 17: 55 bytes on wire (440 bits), 55 bytes captured (440 bits)
Ethernet II, Src: HonHaiPr_01:2f:21 (2c:33:7a:01:2f:21), Dst: D-LinkIn_46:a3:e6 (bc:f6:85:46:a3:e6)
Internet Protocol Version 4, Src: 192.168.0.101 (192.168.0.101), Dst: 216.58.220.37 (216.58.220.37)
Transmission Control Protocol, Src Port: 50413 (50413), Dst Port: 443 (443), Seq: 1, Ack: 1, Len: 1
Secure Sockets Layer

No.     Time           Source                Destination           Protocol Length Info
     18 23.389087000   216.58.220.37         192.168.0.101         TCP      66     443→50413 [ACK] Seq=1 Ack=2 Win=605 Len=0 SLE=1 SRE=2

Frame 18: 66 bytes on wire (528 bits), 66 bytes captured (528 bits)
Ethernet II, Src: D-LinkIn_46:a3:e6 (bc:f6:85:46:a3:e6), Dst: HonHaiPr_01:2f:21 (2c:33:7a:01:2f:21)
Internet Protocol Version 4, Src: 216.58.220.37 (216.58.220.37), Dst: 192.168.0.101 (192.168.0.101)
Transmission Control Protocol, Src Port: 443 (443), Dst Port: 50413 (50413), Seq: 1, Ack: 2, Len: 0

No.     Time           Source                Destination           Protocol Length Info
     19 24.421716000   192.168.0.101         192.168.0.1           DNS      79     Standard query 0x1af8  A clients6.google.com

Frame 19: 79 bytes on wire (632 bits), 79 bytes captured (632 bits)
Ethernet II, Src: HonHaiPr_01:2f:21 (2c:33:7a:01:2f:21), Dst: D-LinkIn_46:a3:e6 (bc:f6:85:46:a3:e6)
Internet Protocol Version 4, Src: 192.168.0.101 (192.168.0.101), Dst: 192.168.0.1 (192.168.0.1)
User Datagram Protocol, Src Port: 49902 (49902), Dst Port: 53 (53)
Domain Name System (query)

No.     Time           Source                Destination           Protocol Length Info
     20 24.454216000   192.168.0.1           192.168.0.101         DNS      119    Standard query response 0x1af8  CNAME clients.l.google.com A 216.58.196.14

Frame 20: 119 bytes on wire (952 bits), 119 bytes captured (952 bits)
Ethernet II, Src: D-LinkIn_46:a3:e6 (bc:f6:85:46:a3:e6), Dst: HonHaiPr_01:2f:21 (2c:33:7a:01:2f:21)
Internet Protocol Version 4, Src: 192.168.0.1 (192.168.0.1), Dst: 192.168.0.101 (192.168.0.101)
User Datagram Protocol, Src Port: 53 (53), Dst Port: 49902 (49902)
Domain Name System (response)

No.     Time           Source                Destination           Protocol Length Info
     21 24.472722000   192.168.0.101         216.58.196.14         QUIC     1392   CID: 16617962996217764247, Seq: 1

Frame 21: 1392 bytes on wire (11136 bits), 1392 bytes captured (11136 bits)
Ethernet II, Src: HonHaiPr_01:2f:21 (2c:33:7a:01:2f:21), Dst: D-LinkIn_46:a3:e6 (bc:f6:85:46:a3:e6)
Internet Protocol Version 4, Src: 192.168.0.101 (192.168.0.101), Dst: 216.58.196.14 (216.58.196.14)
User Datagram Protocol, Src Port: 49903 (49903), Dst Port: 443 (443)
QUIC (Quick UDP Internet Connections)

No.     Time           Source                Destination           Protocol Length Info
     22 24.473853000   192.168.0.101         216.58.196.14         TCP      66     50498→443 [SYN] Seq=0 Win=8192 Len=0 MSS=1460 WS=256 SACK_PERM=1

Frame 22: 66 bytes on wire (528 bits), 66 bytes captured (528 bits)
Ethernet II, Src: HonHaiPr_01:2f:21 (2c:33:7a:01:2f:21), Dst: D-LinkIn_46:a3:e6 (bc:f6:85:46:a3:e6)
Internet Protocol Version 4, Src: 192.168.0.101 (192.168.0.101), Dst: 216.58.196.14 (216.58.196.14)
Transmission Control Protocol, Src Port: 50498 (50498), Dst Port: 443 (443), Seq: 0, Len: 0

No.     Time           Source                Destination           Protocol Length Info
     23 24.474746000   192.168.0.101         216.58.196.14         QUIC     1208   CID: 16617962996217764247, Seq: 2

Frame 23: 1208 bytes on wire (9664 bits), 1208 bytes captured (9664 bits)
Ethernet II, Src: HonHaiPr_01:2f:21 (2c:33:7a:01:2f:21), Dst: D-LinkIn_46:a3:e6 (bc:f6:85:46:a3:e6)
Internet Protocol Version 4, Src: 192.168.0.101 (192.168.0.101), Dst: 216.58.196.14 (216.58.196.14)
User Datagram Protocol, Src Port: 49903 (49903), Dst Port: 443 (443)
QUIC (Quick UDP Internet Connections)

No.     Time           Source                Destination           Protocol Length Info
     24 24.503505000   216.58.196.14         192.168.0.101         TCP      66     443→50498 [SYN, ACK] Seq=0 Ack=1 Win=42900 Len=0 MSS=1430 SACK_PERM=1 WS=128

Frame 24: 66 bytes on wire (528 bits), 66 bytes captured (528 bits)
Ethernet II, Src: D-LinkIn_46:a3:e6 (bc:f6:85:46:a3:e6), Dst: HonHaiPr_01:2f:21 (2c:33:7a:01:2f:21)
Internet Protocol Version 4, Src: 216.58.196.14 (216.58.196.14), Dst: 192.168.0.101 (192.168.0.101)
Transmission Control Protocol, Src Port: 443 (443), Dst Port: 50498 (50498), Seq: 0, Ack: 1, Len: 0

No.     Time           Source                Destination           Protocol Length Info
     25 24.503761000   192.168.0.101         216.58.196.14         TCP      54     50498→443 [ACK] Seq=1 Ack=1 Win=16384 Len=0

Frame 25: 54 bytes on wire (432 bits), 54 bytes captured (432 bits)
Ethernet II, Src: HonHaiPr_01:2f:21 (2c:33:7a:01:2f:21), Dst: D-LinkIn_46:a3:e6 (bc:f6:85:46:a3:e6)
Internet Protocol Version 4, Src: 192.168.0.101 (192.168.0.101), Dst: 216.58.196.14 (216.58.196.14)
Transmission Control Protocol, Src Port: 50498 (50498), Dst Port: 443 (443), Seq: 1, Ack: 1, Len: 0

No.     Time           Source                Destination           Protocol Length Info
     26 24.504878000   192.168.0.101         216.58.196.14         TLSv1.2  571    Client Hello

Frame 26: 571 bytes on wire (4568 bits), 571 bytes captured (4568 bits)
Ethernet II, Src: HonHaiPr_01:2f:21 (2c:33:7a:01:2f:21), Dst: D-LinkIn_46:a3:e6 (bc:f6:85:46:a3:e6)
Internet Protocol Version 4, Src: 192.168.0.101 (192.168.0.101), Dst: 216.58.196.14 (216.58.196.14)
Transmission Control Protocol, Src Port: 50498 (50498), Dst Port: 443 (443), Seq: 1, Ack: 1, Len: 517
Secure Sockets Layer

No.     Time           Source                Destination           Protocol Length Info
     27 24.506675000   216.58.196.14         192.168.0.101         QUIC     1392   CID: 0, Seq: 1

Frame 27: 1392 bytes on wire (11136 bits), 1392 bytes captured (11136 bits)
Ethernet II, Src: D-LinkIn_46:a3:e6 (bc:f6:85:46:a3:e6), Dst: HonHaiPr_01:2f:21 (2c:33:7a:01:2f:21)
Internet Protocol Version 4, Src: 216.58.196.14 (216.58.196.14), Dst: 192.168.0.101 (192.168.0.101)
User Datagram Protocol, Src Port: 443 (443), Dst Port: 49903 (49903)
QUIC (Quick UDP Internet Connections)

No.     Time           Source                Destination           Protocol Length Info
     28 24.513504000   192.168.0.101         216.58.196.14         QUIC     79     CID: 16617962996217764247, Seq: 3

Frame 28: 79 bytes on wire (632 bits), 79 bytes captured (632 bits)
Ethernet II, Src: HonHaiPr_01:2f:21 (2c:33:7a:01:2f:21), Dst: D-LinkIn_46:a3:e6 (bc:f6:85:46:a3:e6)
Internet Protocol Version 4, Src: 192.168.0.101 (192.168.0.101), Dst: 216.58.196.14 (216.58.196.14)
User Datagram Protocol, Src Port: 49903 (49903), Dst Port: 443 (443)
QUIC (Quick UDP Internet Connections)

No.     Time           Source                Destination           Protocol Length Info
     29 24.531092000   216.58.196.14         192.168.0.101         QUIC     71     CID: 0, Seq: 2

Frame 29: 71 bytes on wire (568 bits), 71 bytes captured (568 bits)
Ethernet II, Src: D-LinkIn_46:a3:e6 (bc:f6:85:46:a3:e6), Dst: HonHaiPr_01:2f:21 (2c:33:7a:01:2f:21)
Internet Protocol Version 4, Src: 216.58.196.14 (216.58.196.14), Dst: 192.168.0.101 (192.168.0.101)
User Datagram Protocol, Src Port: 443 (443), Dst Port: 49903 (49903)
QUIC (Quick UDP Internet Connections)

No.     Time           Source                Destination           Protocol Length Info
     30 24.534468000   216.58.196.14         192.168.0.101         TCP      54     443→50498 [ACK] Seq=1 Ack=518 Win=44032 Len=0

Frame 30: 54 bytes on wire (432 bits), 54 bytes captured (432 bits)
Ethernet II, Src: D-LinkIn_46:a3:e6 (bc:f6:85:46:a3:e6), Dst: HonHaiPr_01:2f:21 (2c:33:7a:01:2f:21)
Internet Protocol Version 4, Src: 216.58.196.14 (216.58.196.14), Dst: 192.168.0.101 (192.168.0.101)
Transmission Control Protocol, Src Port: 443 (443), Dst Port: 50498 (50498), Seq: 1, Ack: 518, Len: 0

No.     Time           Source                Destination           Protocol Length Info
     31 24.534619000   216.58.196.14         192.168.0.101         TLSv1.2  204    Server Hello, Change Cipher Spec, Hello Request, Hello Request

Frame 31: 204 bytes on wire (1632 bits), 204 bytes captured (1632 bits)
Ethernet II, Src: D-LinkIn_46:a3:e6 (bc:f6:85:46:a3:e6), Dst: HonHaiPr_01:2f:21 (2c:33:7a:01:2f:21)
Internet Protocol Version 4, Src: 216.58.196.14 (216.58.196.14), Dst: 192.168.0.101 (192.168.0.101)
Transmission Control Protocol, Src Port: 443 (443), Dst Port: 50498 (50498), Seq: 1, Ack: 518, Len: 150
Secure Sockets Layer

No.     Time           Source                Destination           Protocol Length Info
     32 24.535143000   192.168.0.101         216.58.196.14         TLSv1.2  105    Change Cipher Spec, Hello Request, Hello Request

Frame 32: 105 bytes on wire (840 bits), 105 bytes captured (840 bits)
Ethernet II, Src: HonHaiPr_01:2f:21 (2c:33:7a:01:2f:21), Dst: D-LinkIn_46:a3:e6 (bc:f6:85:46:a3:e6)
Internet Protocol Version 4, Src: 192.168.0.101 (192.168.0.101), Dst: 216.58.196.14 (216.58.196.14)
Transmission Control Protocol, Src Port: 50498 (50498), Dst Port: 443 (443), Seq: 518, Ack: 151, Len: 51
Secure Sockets Layer

No.     Time           Source                Destination           Protocol Length Info
     33 24.553404000   192.168.0.101         216.58.196.14         TLSv1.2  107    Application Data

Frame 33: 107 bytes on wire (856 bits), 107 bytes captured (856 bits)
Ethernet II, Src: HonHaiPr_01:2f:21 (2c:33:7a:01:2f:21), Dst: D-LinkIn_46:a3:e6 (bc:f6:85:46:a3:e6)
Internet Protocol Version 4, Src: 192.168.0.101 (192.168.0.101), Dst: 216.58.196.14 (216.58.196.14)
Transmission Control Protocol, Src Port: 50498 (50498), Dst Port: 443 (443), Seq: 569, Ack: 151, Len: 53
Secure Sockets Layer

No.     Time           Source                Destination           Protocol Length Info
     34 24.553596000   192.168.0.101         216.58.196.14         TLSv1.2  104    Application Data

Frame 34: 104 bytes on wire (832 bits), 104 bytes captured (832 bits)
Ethernet II, Src: HonHaiPr_01:2f:21 (2c:33:7a:01:2f:21), Dst: D-LinkIn_46:a3:e6 (bc:f6:85:46:a3:e6)
Internet Protocol Version 4, Src: 192.168.0.101 (192.168.0.101), Dst: 216.58.196.14 (216.58.196.14)
Transmission Control Protocol, Src Port: 50498 (50498), Dst Port: 443 (443), Seq: 622, Ack: 151, Len: 50
Secure Sockets Layer

No.     Time           Source                Destination           Protocol Length Info
     35 24.553833000   192.168.0.101         216.58.196.14         TLSv1.2  96     Application Data

Frame 35: 96 bytes on wire (768 bits), 96 bytes captured (768 bits)
Ethernet II, Src: HonHaiPr_01:2f:21 (2c:33:7a:01:2f:21), Dst: D-LinkIn_46:a3:e6 (bc:f6:85:46:a3:e6)
Internet Protocol Version 4, Src: 192.168.0.101 (192.168.0.101), Dst: 216.58.196.14 (216.58.196.14)
Transmission Control Protocol, Src Port: 50498 (50498), Dst Port: 443 (443), Seq: 672, Ack: 151, Len: 42
Secure Sockets Layer

No.     Time           Source                Destination           Protocol Length Info
     36 24.566030000   216.58.196.14         192.168.0.101         TLSv1.2  110    Application Data

Frame 36: 110 bytes on wire (880 bits), 110 bytes captured (880 bits)
Ethernet II, Src: D-LinkIn_46:a3:e6 (bc:f6:85:46:a3:e6), Dst: HonHaiPr_01:2f:21 (2c:33:7a:01:2f:21)
Internet Protocol Version 4, Src: 216.58.196.14 (216.58.196.14), Dst: 192.168.0.101 (192.168.0.101)
Transmission Control Protocol, Src Port: 443 (443), Dst Port: 50498 (50498), Seq: 151, Ack: 569, Len: 56
Secure Sockets Layer

No.     Time           Source                Destination           Protocol Length Info
     37 24.566033000   216.58.196.14         192.168.0.101         TLSv1.2  96     Application Data

Frame 37: 96 bytes on wire (768 bits), 96 bytes captured (768 bits)
Ethernet II, Src: D-LinkIn_46:a3:e6 (bc:f6:85:46:a3:e6), Dst: HonHaiPr_01:2f:21 (2c:33:7a:01:2f:21)
Internet Protocol Version 4, Src: 216.58.196.14 (216.58.196.14), Dst: 192.168.0.101 (192.168.0.101)
Transmission Control Protocol, Src Port: 443 (443), Dst Port: 50498 (50498), Seq: 207, Ack: 569, Len: 42
Secure Sockets Layer

No.     Time           Source                Destination           Protocol Length Info
     38 24.566257000   192.168.0.101         216.58.196.14         TCP      54     50498→443 [ACK] Seq=714 Ack=249 Win=16128 Len=0

Frame 38: 54 bytes on wire (432 bits), 54 bytes captured (432 bits)
Ethernet II, Src: HonHaiPr_01:2f:21 (2c:33:7a:01:2f:21), Dst: D-LinkIn_46:a3:e6 (bc:f6:85:46:a3:e6)
Internet Protocol Version 4, Src: 192.168.0.101 (192.168.0.101), Dst: 216.58.196.14 (216.58.196.14)
Transmission Control Protocol, Src Port: 50498 (50498), Dst Port: 443 (443), Seq: 714, Ack: 249, Len: 0

No.     Time           Source                Destination           Protocol Length Info
     39 24.566638000   192.168.0.101         216.58.196.14         TLSv1.2  92     Application Data

Frame 39: 92 bytes on wire (736 bits), 92 bytes captured (736 bits)
Ethernet II, Src: HonHaiPr_01:2f:21 (2c:33:7a:01:2f:21), Dst: D-LinkIn_46:a3:e6 (bc:f6:85:46:a3:e6)
Internet Protocol Version 4, Src: 192.168.0.101 (192.168.0.101), Dst: 216.58.196.14 (216.58.196.14)
Transmission Control Protocol, Src Port: 50498 (50498), Dst Port: 443 (443), Seq: 714, Ack: 249, Len: 38
Secure Sockets Layer

No.     Time           Source                Destination           Protocol Length Info
     40 24.567682000   216.58.196.14         192.168.0.101         QUIC     528    CID: 0, Seq: 3

Frame 40: 528 bytes on wire (4224 bits), 528 bytes captured (4224 bits)
Ethernet II, Src: D-LinkIn_46:a3:e6 (bc:f6:85:46:a3:e6), Dst: HonHaiPr_01:2f:21 (2c:33:7a:01:2f:21)
Internet Protocol Version 4, Src: 216.58.196.14 (216.58.196.14), Dst: 192.168.0.101 (192.168.0.101)
User Datagram Protocol, Src Port: 443 (443), Dst Port: 49903 (49903)
QUIC (Quick UDP Internet Connections)

No.     Time           Source                Destination           Protocol Length Info
     41 24.585949000   216.58.196.14         192.168.0.101         TCP      54     443→50498 [ACK] Seq=249 Ack=714 Win=44032 Len=0

Frame 41: 54 bytes on wire (432 bits), 54 bytes captured (432 bits)
Ethernet II, Src: D-LinkIn_46:a3:e6 (bc:f6:85:46:a3:e6), Dst: HonHaiPr_01:2f:21 (2c:33:7a:01:2f:21)
Internet Protocol Version 4, Src: 216.58.196.14 (216.58.196.14), Dst: 192.168.0.101 (192.168.0.101)
Transmission Control Protocol, Src Port: 443 (443), Dst Port: 50498 (50498), Seq: 249, Ack: 714, Len: 0

No.     Time           Source                Destination           Protocol Length Info
     42 24.585951000   216.58.196.14         192.168.0.101         TLSv1.2  92     Application Data

Frame 42: 92 bytes on wire (736 bits), 92 bytes captured (736 bits)
Ethernet II, Src: D-LinkIn_46:a3:e6 (bc:f6:85:46:a3:e6), Dst: HonHaiPr_01:2f:21 (2c:33:7a:01:2f:21)
Internet Protocol Version 4, Src: 216.58.196.14 (216.58.196.14), Dst: 192.168.0.101 (192.168.0.101)
Transmission Control Protocol, Src Port: 443 (443), Dst Port: 50498 (50498), Seq: 249, Ack: 714, Len: 38
Secure Sockets Layer

No.     Time           Source                Destination           Protocol Length Info
     43 24.594212000   192.168.0.101         216.58.196.14         QUIC     1392   CID: 4152999678808870301, Seq: 1

Frame 43: 1392 bytes on wire (11136 bits), 1392 bytes captured (11136 bits)
Ethernet II, Src: HonHaiPr_01:2f:21 (2c:33:7a:01:2f:21), Dst: D-LinkIn_46:a3:e6 (bc:f6:85:46:a3:e6)
Internet Protocol Version 4, Src: 192.168.0.101 (192.168.0.101), Dst: 216.58.196.14 (216.58.196.14)
User Datagram Protocol, Src Port: 49904 (49904), Dst Port: 443 (443)
QUIC (Quick UDP Internet Connections)

No.     Time           Source                Destination           Protocol Length Info
     44 24.595042000   192.168.0.101         216.58.196.14         TCP      66     50499→443 [SYN] Seq=0 Win=8192 Len=0 MSS=1460 WS=256 SACK_PERM=1

Frame 44: 66 bytes on wire (528 bits), 66 bytes captured (528 bits)
Ethernet II, Src: HonHaiPr_01:2f:21 (2c:33:7a:01:2f:21), Dst: D-LinkIn_46:a3:e6 (bc:f6:85:46:a3:e6)
Internet Protocol Version 4, Src: 192.168.0.101 (192.168.0.101), Dst: 216.58.196.14 (216.58.196.14)
Transmission Control Protocol, Src Port: 50499 (50499), Dst Port: 443 (443), Seq: 0, Len: 0

No.     Time           Source                Destination           Protocol Length Info
     45 24.595480000   192.168.0.101         216.58.196.14         QUIC     82     CID: 16617962996217764247, Seq: 4

Frame 45: 82 bytes on wire (656 bits), 82 bytes captured (656 bits)
Ethernet II, Src: HonHaiPr_01:2f:21 (2c:33:7a:01:2f:21), Dst: D-LinkIn_46:a3:e6 (bc:f6:85:46:a3:e6)
Internet Protocol Version 4, Src: 192.168.0.101 (192.168.0.101), Dst: 216.58.196.14 (216.58.196.14)
User Datagram Protocol, Src Port: 49903 (49903), Dst Port: 443 (443)
QUIC (Quick UDP Internet Connections)

No.     Time           Source                Destination           Protocol Length Info
     46 24.625713000   216.58.196.14         192.168.0.101         QUIC     1392   CID: 0, Seq: 1

Frame 46: 1392 bytes on wire (11136 bits), 1392 bytes captured (11136 bits)
Ethernet II, Src: D-LinkIn_46:a3:e6 (bc:f6:85:46:a3:e6), Dst: HonHaiPr_01:2f:21 (2c:33:7a:01:2f:21)
Internet Protocol Version 4, Src: 216.58.196.14 (216.58.196.14), Dst: 192.168.0.101 (192.168.0.101)
User Datagram Protocol, Src Port: 443 (443), Dst Port: 49904 (49904)
QUIC (Quick UDP Internet Connections)

No.     Time           Source                Destination           Protocol Length Info
     47 24.625722000   216.58.196.14         192.168.0.101         TCP      66     443→50499 [SYN, ACK] Seq=0 Ack=1 Win=42900 Len=0 MSS=1430 SACK_PERM=1 WS=128

Frame 47: 66 bytes on wire (528 bits), 66 bytes captured (528 bits)
Ethernet II, Src: D-LinkIn_46:a3:e6 (bc:f6:85:46:a3:e6), Dst: HonHaiPr_01:2f:21 (2c:33:7a:01:2f:21)
Internet Protocol Version 4, Src: 216.58.196.14 (216.58.196.14), Dst: 192.168.0.101 (192.168.0.101)
Transmission Control Protocol, Src Port: 443 (443), Dst Port: 50499 (50499), Seq: 0, Ack: 1, Len: 0

No.     Time           Source                Destination           Protocol Length Info
     48 24.626093000   192.168.0.101         216.58.196.14         TCP      54     50499→443 [ACK] Seq=1 Ack=1 Win=16384 Len=0

Frame 48: 54 bytes on wire (432 bits), 54 bytes captured (432 bits)
Ethernet II, Src: HonHaiPr_01:2f:21 (2c:33:7a:01:2f:21), Dst: D-LinkIn_46:a3:e6 (bc:f6:85:46:a3:e6)
Internet Protocol Version 4, Src: 192.168.0.101 (192.168.0.101), Dst: 216.58.196.14 (216.58.196.14)
Transmission Control Protocol, Src Port: 50499 (50499), Dst Port: 443 (443), Seq: 1, Ack: 1, Len: 0

No.     Time           Source                Destination           Protocol Length Info
     49 24.634021000   192.168.0.101         216.58.196.14         QUIC     1392   CID: 4152999678808870301, Seq: 2

Frame 49: 1392 bytes on wire (11136 bits), 1392 bytes captured (11136 bits)
Ethernet II, Src: HonHaiPr_01:2f:21 (2c:33:7a:01:2f:21), Dst: D-LinkIn_46:a3:e6 (bc:f6:85:46:a3:e6)
Internet Protocol Version 4, Src: 192.168.0.101 (192.168.0.101), Dst: 216.58.196.14 (216.58.196.14)
User Datagram Protocol, Src Port: 49904 (49904), Dst Port: 443 (443)
QUIC (Quick UDP Internet Connections)

No.     Time           Source                Destination           Protocol Length Info
     50 24.634245000   192.168.0.101         216.58.196.14         QUIC     515    CID: 4152999678808870301, Seq: 3

Frame 50: 515 bytes on wire (4120 bits), 515 bytes captured (4120 bits)
Ethernet II, Src: HonHaiPr_01:2f:21 (2c:33:7a:01:2f:21), Dst: D-LinkIn_46:a3:e6 (bc:f6:85:46:a3:e6)
Internet Protocol Version 4, Src: 192.168.0.101 (192.168.0.101), Dst: 216.58.196.14 (216.58.196.14)
User Datagram Protocol, Src Port: 49904 (49904), Dst Port: 443 (443)
QUIC (Quick UDP Internet Connections)

No.     Time           Source                Destination           Protocol Length Info
     51 24.634525000   192.168.0.101         216.58.196.14         QUIC     195    CID: 4152999678808870301, Seq: 4

Frame 51: 195 bytes on wire (1560 bits), 195 bytes captured (1560 bits)
Ethernet II, Src: HonHaiPr_01:2f:21 (2c:33:7a:01:2f:21), Dst: D-LinkIn_46:a3:e6 (bc:f6:85:46:a3:e6)
Internet Protocol Version 4, Src: 192.168.0.101 (192.168.0.101), Dst: 216.58.196.14 (216.58.196.14)
User Datagram Protocol, Src Port: 49904 (49904), Dst Port: 443 (443)
QUIC (Quick UDP Internet Connections)

No.     Time           Source                Destination           Protocol Length Info
     52 24.635645000   192.168.0.101         216.58.196.14         TLSv1.2  571    Client Hello

Frame 52: 571 bytes on wire (4568 bits), 571 bytes captured (4568 bits)
Ethernet II, Src: HonHaiPr_01:2f:21 (2c:33:7a:01:2f:21), Dst: D-LinkIn_46:a3:e6 (bc:f6:85:46:a3:e6)
Internet Protocol Version 4, Src: 192.168.0.101 (192.168.0.101), Dst: 216.58.196.14 (216.58.196.14)
Transmission Control Protocol, Src Port: 50499 (50499), Dst Port: 443 (443), Seq: 1, Ack: 1, Len: 517
Secure Sockets Layer

No.     Time           Source                Destination           Protocol Length Info
     53 24.636018000   216.58.196.14         192.168.0.101         TCP      54     443→50498 [ACK] Seq=287 Ack=752 Win=44032 Len=0

Frame 53: 54 bytes on wire (432 bits), 54 bytes captured (432 bits)
Ethernet II, Src: D-LinkIn_46:a3:e6 (bc:f6:85:46:a3:e6), Dst: HonHaiPr_01:2f:21 (2c:33:7a:01:2f:21)
Internet Protocol Version 4, Src: 216.58.196.14 (216.58.196.14), Dst: 192.168.0.101 (192.168.0.101)
Transmission Control Protocol, Src Port: 443 (443), Dst Port: 50498 (50498), Seq: 287, Ack: 752, Len: 0

No.     Time           Source                Destination           Protocol Length Info
     54 24.636529000   192.168.0.101         216.58.196.14         TCP      54     50498→443 [ACK] Seq=752 Ack=287 Win=16128 Len=0

Frame 54: 54 bytes on wire (432 bits), 54 bytes captured (432 bits)
Ethernet II, Src: HonHaiPr_01:2f:21 (2c:33:7a:01:2f:21), Dst: D-LinkIn_46:a3:e6 (bc:f6:85:46:a3:e6)
Internet Protocol Version 4, Src: 192.168.0.101 (192.168.0.101), Dst: 216.58.196.14 (216.58.196.14)
Transmission Control Protocol, Src Port: 50498 (50498), Dst Port: 443 (443), Seq: 752, Ack: 287, Len: 0

No.     Time           Source                Destination           Protocol Length Info
     55 24.663314000   216.58.196.14         192.168.0.101         QUIC     74     CID: 0, Seq: 2

Frame 55: 74 bytes on wire (592 bits), 74 bytes captured (592 bits)
Ethernet II, Src: D-LinkIn_46:a3:e6 (bc:f6:85:46:a3:e6), Dst: HonHaiPr_01:2f:21 (2c:33:7a:01:2f:21)
Internet Protocol Version 4, Src: 216.58.196.14 (216.58.196.14), Dst: 192.168.0.101 (192.168.0.101)
User Datagram Protocol, Src Port: 443 (443), Dst Port: 49904 (49904)
QUIC (Quick UDP Internet Connections)

No.     Time           Source                Destination           Protocol Length Info
     56 24.664855000   216.58.196.14         192.168.0.101         TCP      54     443→50499 [ACK] Seq=1 Ack=518 Win=44032 Len=0

Frame 56: 54 bytes on wire (432 bits), 54 bytes captured (432 bits)
Ethernet II, Src: D-LinkIn_46:a3:e6 (bc:f6:85:46:a3:e6), Dst: HonHaiPr_01:2f:21 (2c:33:7a:01:2f:21)
Internet Protocol Version 4, Src: 216.58.196.14 (216.58.196.14), Dst: 192.168.0.101 (192.168.0.101)
Transmission Control Protocol, Src Port: 443 (443), Dst Port: 50499 (50499), Seq: 1, Ack: 518, Len: 0

No.     Time           Source                Destination           Protocol Length Info
     57 24.666461000   216.58.196.14         192.168.0.101         TLSv1.2  208    Server Hello, Change Cipher Spec, Hello Request, Hello Request

Frame 57: 208 bytes on wire (1664 bits), 208 bytes captured (1664 bits)
Ethernet II, Src: D-LinkIn_46:a3:e6 (bc:f6:85:46:a3:e6), Dst: HonHaiPr_01:2f:21 (2c:33:7a:01:2f:21)
Internet Protocol Version 4, Src: 216.58.196.14 (216.58.196.14), Dst: 192.168.0.101 (192.168.0.101)
Transmission Control Protocol, Src Port: 443 (443), Dst Port: 50499 (50499), Seq: 1, Ack: 518, Len: 154
Secure Sockets Layer

No.     Time           Source                Destination           Protocol Length Info
     58 24.670593000   192.168.0.101         216.58.196.14         TLSv1.2  270    Change Cipher Spec, Hello Request, Hello Request, Hello Request, Hello Request

Frame 58: 270 bytes on wire (2160 bits), 270 bytes captured (2160 bits)
Ethernet II, Src: HonHaiPr_01:2f:21 (2c:33:7a:01:2f:21), Dst: D-LinkIn_46:a3:e6 (bc:f6:85:46:a3:e6)
Internet Protocol Version 4, Src: 192.168.0.101 (192.168.0.101), Dst: 216.58.196.14 (216.58.196.14)
Transmission Control Protocol, Src Port: 50499 (50499), Dst Port: 443 (443), Seq: 518, Ack: 155, Len: 216
Secure Sockets Layer

No.     Time           Source                Destination           Protocol Length Info
     59 24.688435000   192.168.0.101         216.58.196.14         TLSv1.2  107    Application Data

Frame 59: 107 bytes on wire (856 bits), 107 bytes captured (856 bits)
Ethernet II, Src: HonHaiPr_01:2f:21 (2c:33:7a:01:2f:21), Dst: D-LinkIn_46:a3:e6 (bc:f6:85:46:a3:e6)
Internet Protocol Version 4, Src: 192.168.0.101 (192.168.0.101), Dst: 216.58.196.14 (216.58.196.14)
Transmission Control Protocol, Src Port: 50499 (50499), Dst Port: 443 (443), Seq: 734, Ack: 155, Len: 53
Secure Sockets Layer

No.     Time           Source                Destination           Protocol Length Info
     60 24.688653000   216.58.196.14         192.168.0.101         QUIC     71     CID: 0, Seq: 3

Frame 60: 71 bytes on wire (568 bits), 71 bytes captured (568 bits)
Ethernet II, Src: D-LinkIn_46:a3:e6 (bc:f6:85:46:a3:e6), Dst: HonHaiPr_01:2f:21 (2c:33:7a:01:2f:21)
Internet Protocol Version 4, Src: 216.58.196.14 (216.58.196.14), Dst: 192.168.0.101 (192.168.0.101)
User Datagram Protocol, Src Port: 443 (443), Dst Port: 49904 (49904)
QUIC (Quick UDP Internet Connections)

No.     Time           Source                Destination           Protocol Length Info
     61 24.688787000   192.168.0.101         216.58.196.14         TLSv1.2  104    Application Data

Frame 61: 104 bytes on wire (832 bits), 104 bytes captured (832 bits)
Ethernet II, Src: HonHaiPr_01:2f:21 (2c:33:7a:01:2f:21), Dst: D-LinkIn_46:a3:e6 (bc:f6:85:46:a3:e6)
Internet Protocol Version 4, Src: 192.168.0.101 (192.168.0.101), Dst: 216.58.196.14 (216.58.196.14)
Transmission Control Protocol, Src Port: 50499 (50499), Dst Port: 443 (443), Seq: 787, Ack: 155, Len: 50
Secure Sockets Layer

No.     Time           Source                Destination           Protocol Length Info
     62 24.689049000   192.168.0.101         216.58.196.14         TLSv1.2  96     Application Data

Frame 62: 96 bytes on wire (768 bits), 96 bytes captured (768 bits)
Ethernet II, Src: HonHaiPr_01:2f:21 (2c:33:7a:01:2f:21), Dst: D-LinkIn_46:a3:e6 (bc:f6:85:46:a3:e6)
Internet Protocol Version 4, Src: 192.168.0.101 (192.168.0.101), Dst: 216.58.196.14 (216.58.196.14)
Transmission Control Protocol, Src Port: 50499 (50499), Dst Port: 443 (443), Seq: 837, Ack: 155, Len: 42
Secure Sockets Layer

No.     Time           Source                Destination           Protocol Length Info
     63 24.706151000   216.58.196.14         192.168.0.101         TLSv1.2  110    Application Data

Frame 63: 110 bytes on wire (880 bits), 110 bytes captured (880 bits)
Ethernet II, Src: D-LinkIn_46:a3:e6 (bc:f6:85:46:a3:e6), Dst: HonHaiPr_01:2f:21 (2c:33:7a:01:2f:21)
Internet Protocol Version 4, Src: 216.58.196.14 (216.58.196.14), Dst: 192.168.0.101 (192.168.0.101)
Transmission Control Protocol, Src Port: 443 (443), Dst Port: 50499 (50499), Seq: 155, Ack: 734, Len: 56
Secure Sockets Layer

No.     Time           Source                Destination           Protocol Length Info
     64 24.706365000   216.58.196.14         192.168.0.101         TLSv1.2  96     Application Data

Frame 64: 96 bytes on wire (768 bits), 96 bytes captured (768 bits)
Ethernet II, Src: D-LinkIn_46:a3:e6 (bc:f6:85:46:a3:e6), Dst: HonHaiPr_01:2f:21 (2c:33:7a:01:2f:21)
Internet Protocol Version 4, Src: 216.58.196.14 (216.58.196.14), Dst: 192.168.0.101 (192.168.0.101)
Transmission Control Protocol, Src Port: 443 (443), Dst Port: 50499 (50499), Seq: 211, Ack: 734, Len: 42
Secure Sockets Layer

No.     Time           Source                Destination           Protocol Length Info
     65 24.706484000   192.168.0.101         216.58.196.14         TCP      54     50499→443 [ACK] Seq=879 Ack=253 Win=16128 Len=0

Frame 65: 54 bytes on wire (432 bits), 54 bytes captured (432 bits)
Ethernet II, Src: HonHaiPr_01:2f:21 (2c:33:7a:01:2f:21), Dst: D-LinkIn_46:a3:e6 (bc:f6:85:46:a3:e6)
Internet Protocol Version 4, Src: 192.168.0.101 (192.168.0.101), Dst: 216.58.196.14 (216.58.196.14)
Transmission Control Protocol, Src Port: 50499 (50499), Dst Port: 443 (443), Seq: 879, Ack: 253, Len: 0

No.     Time           Source                Destination           Protocol Length Info
     66 24.706876000   192.168.0.101         216.58.196.14         TLSv1.2  92     Application Data

Frame 66: 92 bytes on wire (736 bits), 92 bytes captured (736 bits)
Ethernet II, Src: HonHaiPr_01:2f:21 (2c:33:7a:01:2f:21), Dst: D-LinkIn_46:a3:e6 (bc:f6:85:46:a3:e6)
Internet Protocol Version 4, Src: 192.168.0.101 (192.168.0.101), Dst: 216.58.196.14 (216.58.196.14)
Transmission Control Protocol, Src Port: 50499 (50499), Dst Port: 443 (443), Seq: 879, Ack: 253, Len: 38
Secure Sockets Layer

No.     Time           Source                Destination           Protocol Length Info
     67 24.729314000   216.58.196.14         192.168.0.101         TCP      54     443→50499 [ACK] Seq=253 Ack=879 Win=45056 Len=0

Frame 67: 54 bytes on wire (432 bits), 54 bytes captured (432 bits)
Ethernet II, Src: D-LinkIn_46:a3:e6 (bc:f6:85:46:a3:e6), Dst: HonHaiPr_01:2f:21 (2c:33:7a:01:2f:21)
Internet Protocol Version 4, Src: 216.58.196.14 (216.58.196.14), Dst: 192.168.0.101 (192.168.0.101)
Transmission Control Protocol, Src Port: 443 (443), Dst Port: 50499 (50499), Seq: 253, Ack: 879, Len: 0

No.     Time           Source                Destination           Protocol Length Info
     68 24.729316000   216.58.196.14         192.168.0.101         TLSv1.2  92     Application Data

Frame 68: 92 bytes on wire (736 bits), 92 bytes captured (736 bits)
Ethernet II, Src: D-LinkIn_46:a3:e6 (bc:f6:85:46:a3:e6), Dst: HonHaiPr_01:2f:21 (2c:33:7a:01:2f:21)
Internet Protocol Version 4, Src: 216.58.196.14 (216.58.196.14), Dst: 192.168.0.101 (192.168.0.101)
Transmission Control Protocol, Src Port: 443 (443), Dst Port: 50499 (50499), Seq: 253, Ack: 879, Len: 38
Secure Sockets Layer

No.     Time           Source                Destination           Protocol Length Info
     69 24.776337000   216.58.196.14         192.168.0.101         TCP      54     443→50499 [ACK] Seq=291 Ack=917 Win=45056 Len=0

Frame 69: 54 bytes on wire (432 bits), 54 bytes captured (432 bits)
Ethernet II, Src: D-LinkIn_46:a3:e6 (bc:f6:85:46:a3:e6), Dst: HonHaiPr_01:2f:21 (2c:33:7a:01:2f:21)
Internet Protocol Version 4, Src: 216.58.196.14 (216.58.196.14), Dst: 192.168.0.101 (192.168.0.101)
Transmission Control Protocol, Src Port: 443 (443), Dst Port: 50499 (50499), Seq: 291, Ack: 917, Len: 0

No.     Time           Source                Destination           Protocol Length Info
     70 24.782080000   192.168.0.101         216.58.196.14         TCP      54     50499→443 [ACK] Seq=917 Ack=291 Win=16128 Len=0

Frame 70: 54 bytes on wire (432 bits), 54 bytes captured (432 bits)
Ethernet II, Src: HonHaiPr_01:2f:21 (2c:33:7a:01:2f:21), Dst: D-LinkIn_46:a3:e6 (bc:f6:85:46:a3:e6)
Internet Protocol Version 4, Src: 192.168.0.101 (192.168.0.101), Dst: 216.58.196.14 (216.58.196.14)
Transmission Control Protocol, Src Port: 50499 (50499), Dst Port: 443 (443), Seq: 917, Ack: 291, Len: 0

No.     Time           Source                Destination           Protocol Length Info
     71 24.980952000   216.58.196.14         192.168.0.101         QUIC     546    CID: 0, Seq: 4

Frame 71: 546 bytes on wire (4368 bits), 546 bytes captured (4368 bits)
Ethernet II, Src: D-LinkIn_46:a3:e6 (bc:f6:85:46:a3:e6), Dst: HonHaiPr_01:2f:21 (2c:33:7a:01:2f:21)
Internet Protocol Version 4, Src: 216.58.196.14 (216.58.196.14), Dst: 192.168.0.101 (192.168.0.101)
User Datagram Protocol, Src Port: 443 (443), Dst Port: 49904 (49904)
QUIC (Quick UDP Internet Connections)

No.     Time           Source                Destination           Protocol Length Info
     72 24.980954000   216.58.196.14         192.168.0.101         QUIC     134    CID: 0, Seq: 5

Frame 72: 134 bytes on wire (1072 bits), 134 bytes captured (1072 bits)
Ethernet II, Src: D-LinkIn_46:a3:e6 (bc:f6:85:46:a3:e6), Dst: HonHaiPr_01:2f:21 (2c:33:7a:01:2f:21)
Internet Protocol Version 4, Src: 216.58.196.14 (216.58.196.14), Dst: 192.168.0.101 (192.168.0.101)
User Datagram Protocol, Src Port: 443 (443), Dst Port: 49904 (49904)
QUIC (Quick UDP Internet Connections)

No.     Time           Source                Destination           Protocol Length Info
     73 24.983251000   192.168.0.101         216.58.196.14         QUIC     88     CID: 4152999678808870301, Seq: 5

Frame 73: 88 bytes on wire (704 bits), 88 bytes captured (704 bits)
Ethernet II, Src: HonHaiPr_01:2f:21 (2c:33:7a:01:2f:21), Dst: D-LinkIn_46:a3:e6 (bc:f6:85:46:a3:e6)
Internet Protocol Version 4, Src: 192.168.0.101 (192.168.0.101), Dst: 216.58.196.14 (216.58.196.14)
User Datagram Protocol, Src Port: 49904 (49904), Dst Port: 443 (443)
QUIC (Quick UDP Internet Connections)

No.     Time           Source                Destination           Protocol Length Info
     74 24.995037000   74.125.200.189        192.168.0.101         QUIC     459    CID: 0, Seq: 66

Frame 74: 459 bytes on wire (3672 bits), 459 bytes captured (3672 bits)
Ethernet II, Src: D-LinkIn_46:a3:e6 (bc:f6:85:46:a3:e6), Dst: HonHaiPr_01:2f:21 (2c:33:7a:01:2f:21)
Internet Protocol Version 4, Src: 74.125.200.189 (74.125.200.189), Dst: 192.168.0.101 (192.168.0.101)
User Datagram Protocol, Src Port: 443 (443), Dst Port: 55655 (55655)
QUIC (Quick UDP Internet Connections)

No.     Time           Source                Destination           Protocol Length Info
     75 25.020014000   192.168.0.101         74.125.200.189        QUIC     83     CID: 4150682161231207588, Seq: 44

Frame 75: 83 bytes on wire (664 bits), 83 bytes captured (664 bits)
Ethernet II, Src: HonHaiPr_01:2f:21 (2c:33:7a:01:2f:21), Dst: D-LinkIn_46:a3:e6 (bc:f6:85:46:a3:e6)
Internet Protocol Version 4, Src: 192.168.0.101 (192.168.0.101), Dst: 74.125.200.189 (74.125.200.189)
User Datagram Protocol, Src Port: 55655 (55655), Dst Port: 443 (443)
QUIC (Quick UDP Internet Connections)

No.     Time           Source                Destination           Protocol Length Info
     76 25.260309000   192.168.0.100         224.0.0.251           MDNS     103    Standard query 0x0000  PTR _FAE9A5F2._sub._googlecast._tcp.local, "QM" question PTR _googlecast._tcp.local, "QM" question

Frame 76: 103 bytes on wire (824 bits), 103 bytes captured (824 bits)
Ethernet II, Src: XiaomiIn_09:3e:bb (18:59:36:09:3e:bb), Dst: IPv4mcast_fb (01:00:5e:00:00:fb)
Internet Protocol Version 4, Src: 192.168.0.100 (192.168.0.100), Dst: 224.0.0.251 (224.0.0.251)
User Datagram Protocol, Src Port: 5353 (5353), Dst Port: 5353 (5353)
Domain Name System (query)

No.     Time           Source                Destination           Protocol Length Info
     77 25.365080000   192.168.0.101         216.58.196.14         QUIC     226    CID: 4152999678808870301, Seq: 6

Frame 77: 226 bytes on wire (1808 bits), 226 bytes captured (1808 bits)
Ethernet II, Src: HonHaiPr_01:2f:21 (2c:33:7a:01:2f:21), Dst: D-LinkIn_46:a3:e6 (bc:f6:85:46:a3:e6)
Internet Protocol Version 4, Src: 192.168.0.101 (192.168.0.101), Dst: 216.58.196.14 (216.58.196.14)
User Datagram Protocol, Src Port: 49904 (49904), Dst Port: 443 (443)
QUIC (Quick UDP Internet Connections)

No.     Time           Source                Destination           Protocol Length Info
     78 25.365384000   192.168.0.101         216.58.196.14         QUIC     201    CID: 4152999678808870301, Seq: 7

Frame 78: 201 bytes on wire (1608 bits), 201 bytes captured (1608 bits)
Ethernet II, Src: HonHaiPr_01:2f:21 (2c:33:7a:01:2f:21), Dst: D-LinkIn_46:a3:e6 (bc:f6:85:46:a3:e6)
Internet Protocol Version 4, Src: 192.168.0.101 (192.168.0.101), Dst: 216.58.196.14 (216.58.196.14)
User Datagram Protocol, Src Port: 49904 (49904), Dst Port: 443 (443)
QUIC (Quick UDP Internet Connections)

No.     Time           Source                Destination           Protocol Length Info
     79 25.394673000   216.58.196.14         192.168.0.101         QUIC     77     CID: 0, Seq: 6

Frame 79: 77 bytes on wire (616 bits), 77 bytes captured (616 bits)
Ethernet II, Src: D-LinkIn_46:a3:e6 (bc:f6:85:46:a3:e6), Dst: HonHaiPr_01:2f:21 (2c:33:7a:01:2f:21)
Internet Protocol Version 4, Src: 216.58.196.14 (216.58.196.14), Dst: 192.168.0.101 (192.168.0.101)
User Datagram Protocol, Src Port: 443 (443), Dst Port: 49904 (49904)
QUIC (Quick UDP Internet Connections)

No.     Time           Source                Destination           Protocol Length Info
     80 25.687319000   216.58.196.14         192.168.0.101         QUIC     140    CID: 0, Seq: 7

Frame 80: 140 bytes on wire (1120 bits), 140 bytes captured (1120 bits)
Ethernet II, Src: D-LinkIn_46:a3:e6 (bc:f6:85:46:a3:e6), Dst: HonHaiPr_01:2f:21 (2c:33:7a:01:2f:21)
Internet Protocol Version 4, Src: 216.58.196.14 (216.58.196.14), Dst: 192.168.0.101 (192.168.0.101)
User Datagram Protocol, Src Port: 443 (443), Dst Port: 49904 (49904)
QUIC (Quick UDP Internet Connections)

No.     Time           Source                Destination           Protocol Length Info
     81 25.687559000   216.58.196.14         192.168.0.101         QUIC     661    CID: 0, Seq: 8

Frame 81: 661 bytes on wire (5288 bits), 661 bytes captured (5288 bits)
Ethernet II, Src: D-LinkIn_46:a3:e6 (bc:f6:85:46:a3:e6), Dst: HonHaiPr_01:2f:21 (2c:33:7a:01:2f:21)
Internet Protocol Version 4, Src: 216.58.196.14 (216.58.196.14), Dst: 192.168.0.101 (192.168.0.101)
User Datagram Protocol, Src Port: 443 (443), Dst Port: 49904 (49904)
QUIC (Quick UDP Internet Connections)

No.     Time           Source                Destination           Protocol Length Info
     82 25.689347000   192.168.0.101         216.58.196.14         QUIC     85     CID: 4152999678808870301, Seq: 8

Frame 82: 85 bytes on wire (680 bits), 85 bytes captured (680 bits)
Ethernet II, Src: HonHaiPr_01:2f:21 (2c:33:7a:01:2f:21), Dst: D-LinkIn_46:a3:e6 (bc:f6:85:46:a3:e6)
Internet Protocol Version 4, Src: 192.168.0.101 (192.168.0.101), Dst: 216.58.196.14 (216.58.196.14)
User Datagram Protocol, Src Port: 49904 (49904), Dst Port: 443 (443)
QUIC (Quick UDP Internet Connections)

No.     Time           Source                Destination           Protocol Length Info
     83 25.757550000   192.168.0.101         216.58.220.46         TLSv1.2  235    Application Data

Frame 83: 235 bytes on wire (1880 bits), 235 bytes captured (1880 bits)
Ethernet II, Src: HonHaiPr_01:2f:21 (2c:33:7a:01:2f:21), Dst: D-LinkIn_46:a3:e6 (bc:f6:85:46:a3:e6)
Internet Protocol Version 4, Src: 192.168.0.101 (192.168.0.101), Dst: 216.58.220.46 (216.58.220.46)
Transmission Control Protocol, Src Port: 50487 (50487), Dst Port: 443 (443), Seq: 2, Ack: 1, Len: 181
Secure Sockets Layer

No.     Time           Source                Destination           Protocol Length Info
     84 25.757850000   192.168.0.101         216.58.220.46         TLSv1.2  100    Application Data

Frame 84: 100 bytes on wire (800 bits), 100 bytes captured (800 bits)
Ethernet II, Src: HonHaiPr_01:2f:21 (2c:33:7a:01:2f:21), Dst: D-LinkIn_46:a3:e6 (bc:f6:85:46:a3:e6)
Internet Protocol Version 4, Src: 192.168.0.101 (192.168.0.101), Dst: 216.58.220.46 (216.58.220.46)
Transmission Control Protocol, Src Port: 50487 (50487), Dst Port: 443 (443), Seq: 183, Ack: 1, Len: 46
Secure Sockets Layer

No.     Time           Source                Destination           Protocol Length Info
     85 25.758094000   192.168.0.101         216.58.220.46         TLSv1.2  258    Application Data

Frame 85: 258 bytes on wire (2064 bits), 258 bytes captured (2064 bits)
Ethernet II, Src: HonHaiPr_01:2f:21 (2c:33:7a:01:2f:21), Dst: D-LinkIn_46:a3:e6 (bc:f6:85:46:a3:e6)
Internet Protocol Version 4, Src: 192.168.0.101 (192.168.0.101), Dst: 216.58.220.46 (216.58.220.46)
Transmission Control Protocol, Src Port: 50487 (50487), Dst Port: 443 (443), Seq: 229, Ack: 1, Len: 204
Secure Sockets Layer

No.     Time           Source                Destination           Protocol Length Info
     86 25.761202000   192.168.0.101         192.168.0.1           DNS      75     Standard query 0x0fcd  A plus.google.com

Frame 86: 75 bytes on wire (600 bits), 75 bytes captured (600 bits)
Ethernet II, Src: HonHaiPr_01:2f:21 (2c:33:7a:01:2f:21), Dst: D-LinkIn_46:a3:e6 (bc:f6:85:46:a3:e6)
Internet Protocol Version 4, Src: 192.168.0.101 (192.168.0.101), Dst: 192.168.0.1 (192.168.0.1)
User Datagram Protocol, Src Port: 61235 (61235), Dst Port: 53 (53)
Domain Name System (query)

No.     Time           Source                Destination           Protocol Length Info
     87 25.767822000   216.58.220.46         192.168.0.101         TCP      54     443→50487 [ACK] Seq=1 Ack=183 Win=404 Len=0

Frame 87: 54 bytes on wire (432 bits), 54 bytes captured (432 bits)
Ethernet II, Src: D-LinkIn_46:a3:e6 (bc:f6:85:46:a3:e6), Dst: HonHaiPr_01:2f:21 (2c:33:7a:01:2f:21)
Internet Protocol Version 4, Src: 216.58.220.46 (216.58.220.46), Dst: 192.168.0.101 (192.168.0.101)
Transmission Control Protocol, Src Port: 443 (443), Dst Port: 50487 (50487), Seq: 1, Ack: 183, Len: 0

No.     Time           Source                Destination           Protocol Length Info
     88 25.769097000   216.58.220.46         192.168.0.101         TCP      54     443→50487 [ACK] Seq=1 Ack=229 Win=404 Len=0

Frame 88: 54 bytes on wire (432 bits), 54 bytes captured (432 bits)
Ethernet II, Src: D-LinkIn_46:a3:e6 (bc:f6:85:46:a3:e6), Dst: HonHaiPr_01:2f:21 (2c:33:7a:01:2f:21)
Internet Protocol Version 4, Src: 216.58.220.46 (216.58.220.46), Dst: 192.168.0.101 (192.168.0.101)
Transmission Control Protocol, Src Port: 443 (443), Dst Port: 50487 (50487), Seq: 1, Ack: 229, Len: 0

No.     Time           Source                Destination           Protocol Length Info
     89 25.769099000   216.58.220.46         192.168.0.101         TCP      54     443→50487 [ACK] Seq=1 Ack=433 Win=421 Len=0

Frame 89: 54 bytes on wire (432 bits), 54 bytes captured (432 bits)
Ethernet II, Src: D-LinkIn_46:a3:e6 (bc:f6:85:46:a3:e6), Dst: HonHaiPr_01:2f:21 (2c:33:7a:01:2f:21)
Internet Protocol Version 4, Src: 216.58.220.46 (216.58.220.46), Dst: 192.168.0.101 (192.168.0.101)
Transmission Control Protocol, Src Port: 443 (443), Dst Port: 50487 (50487), Seq: 1, Ack: 433, Len: 0

No.     Time           Source                Destination           Protocol Length Info
     90 25.772880000   216.58.220.46         192.168.0.101         TLSv1.2  100    Application Data

Frame 90: 100 bytes on wire (800 bits), 100 bytes captured (800 bits)
Ethernet II, Src: D-LinkIn_46:a3:e6 (bc:f6:85:46:a3:e6), Dst: HonHaiPr_01:2f:21 (2c:33:7a:01:2f:21)
Internet Protocol Version 4, Src: 216.58.220.46 (216.58.220.46), Dst: 192.168.0.101 (192.168.0.101)
Transmission Control Protocol, Src Port: 443 (443), Dst Port: 50487 (50487), Seq: 1, Ack: 433, Len: 46
Secure Sockets Layer

No.     Time           Source                Destination           Protocol Length Info
     91 25.795096000   192.168.0.1           192.168.0.101         DNS      91     Standard query response 0x0fcd  A 216.58.220.46

Frame 91: 91 bytes on wire (728 bits), 91 bytes captured (728 bits)
Ethernet II, Src: D-LinkIn_46:a3:e6 (bc:f6:85:46:a3:e6), Dst: HonHaiPr_01:2f:21 (2c:33:7a:01:2f:21)
Internet Protocol Version 4, Src: 192.168.0.1 (192.168.0.1), Dst: 192.168.0.101 (192.168.0.101)
User Datagram Protocol, Src Port: 53 (53), Dst Port: 61235 (61235)
Domain Name System (response)

No.     Time           Source                Destination           Protocol Length Info
     92 25.817139000   192.168.0.101         216.58.220.46         QUIC     1392   CID: 15608385890186210100, Seq: 1

Frame 92: 1392 bytes on wire (11136 bits), 1392 bytes captured (11136 bits)
Ethernet II, Src: HonHaiPr_01:2f:21 (2c:33:7a:01:2f:21), Dst: D-LinkIn_46:a3:e6 (bc:f6:85:46:a3:e6)
Internet Protocol Version 4, Src: 192.168.0.101 (192.168.0.101), Dst: 216.58.220.46 (216.58.220.46)
User Datagram Protocol, Src Port: 61236 (61236), Dst Port: 443 (443)
QUIC (Quick UDP Internet Connections)

No.     Time           Source                Destination           Protocol Length Info
     93 25.824130000   192.168.0.101         216.58.220.46         TCP      54     50487→443 [ACK] Seq=433 Ack=47 Win=59 Len=0

Frame 93: 54 bytes on wire (432 bits), 54 bytes captured (432 bits)
Ethernet II, Src: HonHaiPr_01:2f:21 (2c:33:7a:01:2f:21), Dst: D-LinkIn_46:a3:e6 (bc:f6:85:46:a3:e6)
Internet Protocol Version 4, Src: 192.168.0.101 (192.168.0.101), Dst: 216.58.220.46 (216.58.220.46)
Transmission Control Protocol, Src Port: 50487 (50487), Dst Port: 443 (443), Seq: 433, Ack: 47, Len: 0

No.     Time           Source                Destination           Protocol Length Info
     94 25.831593000   216.58.220.46         192.168.0.101         QUIC     1392   CID: 0, Seq: 1

Frame 94: 1392 bytes on wire (11136 bits), 1392 bytes captured (11136 bits)
Ethernet II, Src: D-LinkIn_46:a3:e6 (bc:f6:85:46:a3:e6), Dst: HonHaiPr_01:2f:21 (2c:33:7a:01:2f:21)
Internet Protocol Version 4, Src: 216.58.220.46 (216.58.220.46), Dst: 192.168.0.101 (192.168.0.101)
User Datagram Protocol, Src Port: 443 (443), Dst Port: 61236 (61236)
QUIC (Quick UDP Internet Connections)

No.     Time           Source                Destination           Protocol Length Info
     95 25.839995000   192.168.0.101         216.58.220.46         QUIC     79     CID: 15608385890186210100, Seq: 2

Frame 95: 79 bytes on wire (632 bits), 79 bytes captured (632 bits)
Ethernet II, Src: HonHaiPr_01:2f:21 (2c:33:7a:01:2f:21), Dst: D-LinkIn_46:a3:e6 (bc:f6:85:46:a3:e6)
Internet Protocol Version 4, Src: 192.168.0.101 (192.168.0.101), Dst: 216.58.220.46 (216.58.220.46)
User Datagram Protocol, Src Port: 61236 (61236), Dst Port: 443 (443)
QUIC (Quick UDP Internet Connections)

No.     Time           Source                Destination           Protocol Length Info
     96 26.072201000   216.58.220.46         192.168.0.101         TLSv1.2  129    Application Data

Frame 96: 129 bytes on wire (1032 bits), 129 bytes captured (1032 bits)
Ethernet II, Src: D-LinkIn_46:a3:e6 (bc:f6:85:46:a3:e6), Dst: HonHaiPr_01:2f:21 (2c:33:7a:01:2f:21)
Internet Protocol Version 4, Src: 216.58.220.46 (216.58.220.46), Dst: 192.168.0.101 (192.168.0.101)
Transmission Control Protocol, Src Port: 443 (443), Dst Port: 50487 (50487), Seq: 47, Ack: 433, Len: 75
Secure Sockets Layer

No.     Time           Source                Destination           Protocol Length Info
     97 26.072204000   216.58.220.46         192.168.0.101         TLSv1.2  402    Application Data

Frame 97: 402 bytes on wire (3216 bits), 402 bytes captured (3216 bits)
Ethernet II, Src: D-LinkIn_46:a3:e6 (bc:f6:85:46:a3:e6), Dst: HonHaiPr_01:2f:21 (2c:33:7a:01:2f:21)
Internet Protocol Version 4, Src: 216.58.220.46 (216.58.220.46), Dst: 192.168.0.101 (192.168.0.101)
Transmission Control Protocol, Src Port: 443 (443), Dst Port: 50487 (50487), Seq: 122, Ack: 433, Len: 348
Secure Sockets Layer

No.     Time           Source                Destination           Protocol Length Info
     98 26.072434000   192.168.0.101         216.58.220.46         TCP      54     50487→443 [ACK] Seq=433 Ack=470 Win=64 Len=0

Frame 98: 54 bytes on wire (432 bits), 54 bytes captured (432 bits)
Ethernet II, Src: HonHaiPr_01:2f:21 (2c:33:7a:01:2f:21), Dst: D-LinkIn_46:a3:e6 (bc:f6:85:46:a3:e6)
Internet Protocol Version 4, Src: 192.168.0.101 (192.168.0.101), Dst: 216.58.220.46 (216.58.220.46)
Transmission Control Protocol, Src Port: 50487 (50487), Dst Port: 443 (443), Seq: 433, Ack: 470, Len: 0

No.     Time           Source                Destination           Protocol Length Info
     99 26.221231000   216.58.220.46         192.168.0.101         TLSv1.2  344    Application Data

Frame 99: 344 bytes on wire (2752 bits), 344 bytes captured (2752 bits)
Ethernet II, Src: D-LinkIn_46:a3:e6 (bc:f6:85:46:a3:e6), Dst: HonHaiPr_01:2f:21 (2c:33:7a:01:2f:21)
Internet Protocol Version 4, Src: 216.58.220.46 (216.58.220.46), Dst: 192.168.0.101 (192.168.0.101)
Transmission Control Protocol, Src Port: 443 (443), Dst Port: 50487 (50487), Seq: 470, Ack: 433, Len: 290
Secure Sockets Layer

No.     Time           Source                Destination           Protocol Length Info
    100 26.234220000   216.58.220.46         192.168.0.101         TLSv1.2  159    Application Data

Frame 100: 159 bytes on wire (1272 bits), 159 bytes captured (1272 bits)
Ethernet II, Src: D-LinkIn_46:a3:e6 (bc:f6:85:46:a3:e6), Dst: HonHaiPr_01:2f:21 (2c:33:7a:01:2f:21)
Internet Protocol Version 4, Src: 216.58.220.46 (216.58.220.46), Dst: 192.168.0.101 (192.168.0.101)
Transmission Control Protocol, Src Port: 443 (443), Dst Port: 50487 (50487), Seq: 760, Ack: 433, Len: 105
Secure Sockets Layer

No.     Time           Source                Destination           Protocol Length Info
    101 26.234223000   216.58.220.46         192.168.0.101         TLSv1.2  100    Application Data

Frame 101: 100 bytes on wire (800 bits), 100 bytes captured (800 bits)
Ethernet II, Src: D-LinkIn_46:a3:e6 (bc:f6:85:46:a3:e6), Dst: HonHaiPr_01:2f:21 (2c:33:7a:01:2f:21)
Internet Protocol Version 4, Src: 216.58.220.46 (216.58.220.46), Dst: 192.168.0.101 (192.168.0.101)
Transmission Control Protocol, Src Port: 443 (443), Dst Port: 50487 (50487), Seq: 865, Ack: 433, Len: 46
Secure Sockets Layer

No.     Time           Source                Destination           Protocol Length Info
    102 26.234447000   192.168.0.101         216.58.220.46         TCP      54     50487→443 [ACK] Seq=433 Ack=911 Win=63 Len=0

Frame 102: 54 bytes on wire (432 bits), 54 bytes captured (432 bits)
Ethernet II, Src: HonHaiPr_01:2f:21 (2c:33:7a:01:2f:21), Dst: D-LinkIn_46:a3:e6 (bc:f6:85:46:a3:e6)
Internet Protocol Version 4, Src: 192.168.0.101 (192.168.0.101), Dst: 216.58.220.46 (216.58.220.46)
Transmission Control Protocol, Src Port: 50487 (50487), Dst Port: 443 (443), Seq: 433, Ack: 911, Len: 0

No.     Time           Source                Destination           Protocol Length Info
    103 26.235468000   192.168.0.101         216.58.220.46         TLSv1.2  100    Application Data

Frame 103: 100 bytes on wire (800 bits), 100 bytes captured (800 bits)
Ethernet II, Src: HonHaiPr_01:2f:21 (2c:33:7a:01:2f:21), Dst: D-LinkIn_46:a3:e6 (bc:f6:85:46:a3:e6)
Internet Protocol Version 4, Src: 192.168.0.101 (192.168.0.101), Dst: 216.58.220.46 (216.58.220.46)
Transmission Control Protocol, Src Port: 50487 (50487), Dst Port: 443 (443), Seq: 433, Ack: 911, Len: 46
Secure Sockets Layer

No.     Time           Source                Destination           Protocol Length Info
    104 26.284670000   216.58.220.46         192.168.0.101         TCP      54     443→50487 [ACK] Seq=911 Ack=479 Win=421 Len=0

Frame 104: 54 bytes on wire (432 bits), 54 bytes captured (432 bits)
Ethernet II, Src: D-LinkIn_46:a3:e6 (bc:f6:85:46:a3:e6), Dst: HonHaiPr_01:2f:21 (2c:33:7a:01:2f:21)
Internet Protocol Version 4, Src: 216.58.220.46 (216.58.220.46), Dst: 192.168.0.101 (192.168.0.101)
Transmission Control Protocol, Src Port: 443 (443), Dst Port: 50487 (50487), Seq: 911, Ack: 479, Len: 0

No.     Time           Source                Destination           Protocol Length Info
    105 27.436692000   192.168.0.101         192.168.0.1           DNS      75     Standard query 0x82bc  A play.google.com

Frame 105: 75 bytes on wire (600 bits), 75 bytes captured (600 bits)
Ethernet II, Src: HonHaiPr_01:2f:21 (2c:33:7a:01:2f:21), Dst: D-LinkIn_46:a3:e6 (bc:f6:85:46:a3:e6)
Internet Protocol Version 4, Src: 192.168.0.101 (192.168.0.101), Dst: 192.168.0.1 (192.168.0.1)
User Datagram Protocol, Src Port: 62930 (62930), Dst Port: 53 (53)
Domain Name System (query)

No.     Time           Source                Destination           Protocol Length Info
    106 27.468630000   192.168.0.1           192.168.0.101         DNS      112    Standard query response 0x82bc  CNAME play.l.google.com A 216.58.220.46

Frame 106: 112 bytes on wire (896 bits), 112 bytes captured (896 bits)
Ethernet II, Src: D-LinkIn_46:a3:e6 (bc:f6:85:46:a3:e6), Dst: HonHaiPr_01:2f:21 (2c:33:7a:01:2f:21)
Internet Protocol Version 4, Src: 192.168.0.1 (192.168.0.1), Dst: 192.168.0.101 (192.168.0.101)
User Datagram Protocol, Src Port: 53 (53), Dst Port: 62930 (62930)
Domain Name System (response)

No.     Time           Source                Destination           Protocol Length Info
    107 27.471495000   192.168.0.101         216.58.220.46         QUIC     1392   CID: 15608385890186210100, Seq: 3

Frame 107: 1392 bytes on wire (11136 bits), 1392 bytes captured (11136 bits)
Ethernet II, Src: HonHaiPr_01:2f:21 (2c:33:7a:01:2f:21), Dst: D-LinkIn_46:a3:e6 (bc:f6:85:46:a3:e6)
Internet Protocol Version 4, Src: 192.168.0.101 (192.168.0.101), Dst: 216.58.220.46 (216.58.220.46)
User Datagram Protocol, Src Port: 61236 (61236), Dst Port: 443 (443)
QUIC (Quick UDP Internet Connections)

No.     Time           Source                Destination           Protocol Length Info
    108 27.471744000   192.168.0.101         216.58.220.46         QUIC     474    CID: 15608385890186210100, Seq: 4

Frame 108: 474 bytes on wire (3792 bits), 474 bytes captured (3792 bits)
Ethernet II, Src: HonHaiPr_01:2f:21 (2c:33:7a:01:2f:21), Dst: D-LinkIn_46:a3:e6 (bc:f6:85:46:a3:e6)
Internet Protocol Version 4, Src: 192.168.0.101 (192.168.0.101), Dst: 216.58.220.46 (216.58.220.46)
User Datagram Protocol, Src Port: 61236 (61236), Dst Port: 443 (443)
QUIC (Quick UDP Internet Connections)

No.     Time           Source                Destination           Protocol Length Info
    109 27.472045000   192.168.0.101         216.58.220.46         QUIC     1392   CID: 15608385890186210100, Seq: 5

Frame 109: 1392 bytes on wire (11136 bits), 1392 bytes captured (11136 bits)
Ethernet II, Src: HonHaiPr_01:2f:21 (2c:33:7a:01:2f:21), Dst: D-LinkIn_46:a3:e6 (bc:f6:85:46:a3:e6)
Internet Protocol Version 4, Src: 192.168.0.101 (192.168.0.101), Dst: 216.58.220.46 (216.58.220.46)
User Datagram Protocol, Src Port: 61236 (61236), Dst Port: 443 (443)
QUIC (Quick UDP Internet Connections)

No.     Time           Source                Destination           Protocol Length Info
    110 27.472284000   192.168.0.101         216.58.220.46         QUIC     705    CID: 15608385890186210100, Seq: 6

Frame 110: 705 bytes on wire (5640 bits), 705 bytes captured (5640 bits)
Ethernet II, Src: HonHaiPr_01:2f:21 (2c:33:7a:01:2f:21), Dst: D-LinkIn_46:a3:e6 (bc:f6:85:46:a3:e6)
Internet Protocol Version 4, Src: 192.168.0.101 (192.168.0.101), Dst: 216.58.220.46 (216.58.220.46)
User Datagram Protocol, Src Port: 61236 (61236), Dst Port: 443 (443)
QUIC (Quick UDP Internet Connections)

No.     Time           Source                Destination           Protocol Length Info
    111 27.482616000   216.58.220.46         192.168.0.101         QUIC     77     CID: 0, Seq: 2

Frame 111: 77 bytes on wire (616 bits), 77 bytes captured (616 bits)
Ethernet II, Src: D-LinkIn_46:a3:e6 (bc:f6:85:46:a3:e6), Dst: HonHaiPr_01:2f:21 (2c:33:7a:01:2f:21)
Internet Protocol Version 4, Src: 216.58.220.46 (216.58.220.46), Dst: 192.168.0.101 (192.168.0.101)
User Datagram Protocol, Src Port: 443 (443), Dst Port: 61236 (61236)
QUIC (Quick UDP Internet Connections)

No.     Time           Source                Destination           Protocol Length Info
    112 27.482618000   216.58.220.46         192.168.0.101         QUIC     74     CID: 0, Seq: 3

Frame 112: 74 bytes on wire (592 bits), 74 bytes captured (592 bits)
Ethernet II, Src: D-LinkIn_46:a3:e6 (bc:f6:85:46:a3:e6), Dst: HonHaiPr_01:2f:21 (2c:33:7a:01:2f:21)
Internet Protocol Version 4, Src: 216.58.220.46 (216.58.220.46), Dst: 192.168.0.101 (192.168.0.101)
User Datagram Protocol, Src Port: 443 (443), Dst Port: 61236 (61236)
QUIC (Quick UDP Internet Connections)

No.     Time           Source                Destination           Protocol Length Info
    113 27.678779000   216.58.220.46         192.168.0.101         QUIC     390    CID: 0, Seq: 4

Frame 113: 390 bytes on wire (3120 bits), 390 bytes captured (3120 bits)
Ethernet II, Src: D-LinkIn_46:a3:e6 (bc:f6:85:46:a3:e6), Dst: HonHaiPr_01:2f:21 (2c:33:7a:01:2f:21)
Internet Protocol Version 4, Src: 216.58.220.46 (216.58.220.46), Dst: 192.168.0.101 (192.168.0.101)
User Datagram Protocol, Src Port: 443 (443), Dst Port: 61236 (61236)
QUIC (Quick UDP Internet Connections)

No.     Time           Source                Destination           Protocol Length Info
    114 27.696672000   192.168.0.101         216.58.220.46         QUIC     85     CID: 15608385890186210100, Seq: 7

Frame 114: 85 bytes on wire (680 bits), 85 bytes captured (680 bits)
Ethernet II, Src: HonHaiPr_01:2f:21 (2c:33:7a:01:2f:21), Dst: D-LinkIn_46:a3:e6 (bc:f6:85:46:a3:e6)
Internet Protocol Version 4, Src: 192.168.0.101 (192.168.0.101), Dst: 216.58.220.46 (216.58.220.46)
User Datagram Protocol, Src Port: 61236 (61236), Dst Port: 443 (443)
QUIC (Quick UDP Internet Connections)

No.     Time           Source                Destination           Protocol Length Info
    115 27.755289000   192.168.0.101         216.58.196.14         QUIC     165    CID: 16617962996217764247, Seq: 5

Frame 115: 165 bytes on wire (1320 bits), 165 bytes captured (1320 bits)
Ethernet II, Src: HonHaiPr_01:2f:21 (2c:33:7a:01:2f:21), Dst: D-LinkIn_46:a3:e6 (bc:f6:85:46:a3:e6)
Internet Protocol Version 4, Src: 192.168.0.101 (192.168.0.101), Dst: 216.58.196.14 (216.58.196.14)
User Datagram Protocol, Src Port: 49903 (49903), Dst Port: 443 (443)
QUIC (Quick UDP Internet Connections)

No.     Time           Source                Destination           Protocol Length Info
    116 27.814185000   216.58.196.14         192.168.0.101         QUIC     77     CID: 0, Seq: 4

Frame 116: 77 bytes on wire (616 bits), 77 bytes captured (616 bits)
Ethernet II, Src: D-LinkIn_46:a3:e6 (bc:f6:85:46:a3:e6), Dst: HonHaiPr_01:2f:21 (2c:33:7a:01:2f:21)
Internet Protocol Version 4, Src: 216.58.196.14 (216.58.196.14), Dst: 192.168.0.101 (192.168.0.101)
User Datagram Protocol, Src Port: 443 (443), Dst Port: 49903 (49903)
QUIC (Quick UDP Internet Connections)

No.     Time           Source                Destination           Protocol Length Info
    117 27.849083000   216.58.196.14         192.168.0.101         QUIC     173    CID: 0, Seq: 5

Frame 117: 173 bytes on wire (1384 bits), 173 bytes captured (1384 bits)
Ethernet II, Src: D-LinkIn_46:a3:e6 (bc:f6:85:46:a3:e6), Dst: HonHaiPr_01:2f:21 (2c:33:7a:01:2f:21)
Internet Protocol Version 4, Src: 216.58.196.14 (216.58.196.14), Dst: 192.168.0.101 (192.168.0.101)
User Datagram Protocol, Src Port: 443 (443), Dst Port: 49903 (49903)
QUIC (Quick UDP Internet Connections)

No.     Time           Source                Destination           Protocol Length Info
    118 27.854459000   192.168.0.101         216.58.196.14         QUIC     212    CID: 4152999678808870301, Seq: 9

Frame 118: 212 bytes on wire (1696 bits), 212 bytes captured (1696 bits)
Ethernet II, Src: HonHaiPr_01:2f:21 (2c:33:7a:01:2f:21), Dst: D-LinkIn_46:a3:e6 (bc:f6:85:46:a3:e6)
Internet Protocol Version 4, Src: 192.168.0.101 (192.168.0.101), Dst: 216.58.196.14 (216.58.196.14)
User Datagram Protocol, Src Port: 49904 (49904), Dst Port: 443 (443)
QUIC (Quick UDP Internet Connections)

No.     Time           Source                Destination           Protocol Length Info
    119 27.854756000   192.168.0.101         216.58.196.14         QUIC     208    CID: 4152999678808870301, Seq: 10

Frame 119: 208 bytes on wire (1664 bits), 208 bytes captured (1664 bits)
Ethernet II, Src: HonHaiPr_01:2f:21 (2c:33:7a:01:2f:21), Dst: D-LinkIn_46:a3:e6 (bc:f6:85:46:a3:e6)
Internet Protocol Version 4, Src: 192.168.0.101 (192.168.0.101), Dst: 216.58.196.14 (216.58.196.14)
User Datagram Protocol, Src Port: 49904 (49904), Dst Port: 443 (443)
QUIC (Quick UDP Internet Connections)

No.     Time           Source                Destination           Protocol Length Info
    120 27.866691000   192.168.0.101         216.58.196.14         QUIC     82     CID: 16617962996217764247, Seq: 6

Frame 120: 82 bytes on wire (656 bits), 82 bytes captured (656 bits)
Ethernet II, Src: HonHaiPr_01:2f:21 (2c:33:7a:01:2f:21), Dst: D-LinkIn_46:a3:e6 (bc:f6:85:46:a3:e6)
Internet Protocol Version 4, Src: 192.168.0.101 (192.168.0.101), Dst: 216.58.196.14 (216.58.196.14)
User Datagram Protocol, Src Port: 49903 (49903), Dst Port: 443 (443)
QUIC (Quick UDP Internet Connections)

No.     Time           Source                Destination           Protocol Length Info
    121 27.883739000   216.58.196.14         192.168.0.101         QUIC     77     CID: 0, Seq: 9

Frame 121: 77 bytes on wire (616 bits), 77 bytes captured (616 bits)
Ethernet II, Src: D-LinkIn_46:a3:e6 (bc:f6:85:46:a3:e6), Dst: HonHaiPr_01:2f:21 (2c:33:7a:01:2f:21)
Internet Protocol Version 4, Src: 216.58.196.14 (216.58.196.14), Dst: 192.168.0.101 (192.168.0.101)
User Datagram Protocol, Src Port: 443 (443), Dst Port: 49904 (49904)
QUIC (Quick UDP Internet Connections)

No.     Time           Source                Destination           Protocol Length Info
    122 28.217215000   216.58.196.14         192.168.0.101         QUIC     165    CID: 0, Seq: 10

Frame 122: 165 bytes on wire (1320 bits), 165 bytes captured (1320 bits)
Ethernet II, Src: D-LinkIn_46:a3:e6 (bc:f6:85:46:a3:e6), Dst: HonHaiPr_01:2f:21 (2c:33:7a:01:2f:21)
Internet Protocol Version 4, Src: 216.58.196.14 (216.58.196.14), Dst: 192.168.0.101 (192.168.0.101)
User Datagram Protocol, Src Port: 443 (443), Dst Port: 49904 (49904)
QUIC (Quick UDP Internet Connections)

No.     Time           Source                Destination           Protocol Length Info
    123 28.218663000   216.58.196.14         192.168.0.101         QUIC     192    CID: 0, Seq: 11

Frame 123: 192 bytes on wire (1536 bits), 192 bytes captured (1536 bits)
Ethernet II, Src: D-LinkIn_46:a3:e6 (bc:f6:85:46:a3:e6), Dst: HonHaiPr_01:2f:21 (2c:33:7a:01:2f:21)
Internet Protocol Version 4, Src: 216.58.196.14 (216.58.196.14), Dst: 192.168.0.101 (192.168.0.101)
User Datagram Protocol, Src Port: 443 (443), Dst Port: 49904 (49904)
QUIC (Quick UDP Internet Connections)

No.     Time           Source                Destination           Protocol Length Info
    124 28.219454000   192.168.0.101         216.58.196.14         QUIC     85     CID: 4152999678808870301, Seq: 11

Frame 124: 85 bytes on wire (680 bits), 85 bytes captured (680 bits)
Ethernet II, Src: HonHaiPr_01:2f:21 (2c:33:7a:01:2f:21), Dst: D-LinkIn_46:a3:e6 (bc:f6:85:46:a3:e6)
Internet Protocol Version 4, Src: 192.168.0.101 (192.168.0.101), Dst: 216.58.196.14 (216.58.196.14)
User Datagram Protocol, Src Port: 49904 (49904), Dst Port: 443 (443)
QUIC (Quick UDP Internet Connections)

No.     Time           Source                Destination           Protocol Length Info
    125 29.607055000   204.79.197.200        192.168.0.101         TCP      54     443→50491 [RST, ACK] Seq=1 Ack=1 Win=0 Len=0

Frame 125: 54 bytes on wire (432 bits), 54 bytes captured (432 bits)
Ethernet II, Src: D-LinkIn_46:a3:e6 (bc:f6:85:46:a3:e6), Dst: HonHaiPr_01:2f:21 (2c:33:7a:01:2f:21)
Internet Protocol Version 4, Src: 204.79.197.200 (204.79.197.200), Dst: 192.168.0.101 (192.168.0.101)
Transmission Control Protocol, Src Port: 443 (443), Dst Port: 50491 (50491), Seq: 1, Ack: 1, Len: 0

No.     Time           Source                Destination           Protocol Length Info
    126 30.035801000   192.168.0.101         192.168.0.255         BROWSER  254    Domain/Workgroup Announcement WORKGROUP, NT Workstation, Domain Enum

Frame 126: 254 bytes on wire (2032 bits), 254 bytes captured (2032 bits)
Ethernet II, Src: HonHaiPr_01:2f:21 (2c:33:7a:01:2f:21), Dst: Broadcast (ff:ff:ff:ff:ff:ff)
Internet Protocol Version 4, Src: 192.168.0.101 (192.168.0.101), Dst: 192.168.0.255 (192.168.0.255)
User Datagram Protocol, Src Port: 138 (138), Dst Port: 138 (138)
NetBIOS Datagram Service
SMB (Server Message Block Protocol)
SMB MailSlot Protocol
Microsoft Windows Browser Protocol

No.     Time           Source                Destination           Protocol Length Info
    127 30.380344000   192.168.0.103         239.255.255.250       SSDP     171    M-SEARCH * HTTP/1.1 

Frame 127: 171 bytes on wire (1368 bits), 171 bytes captured (1368 bits)
Ethernet II, Src: LgElectr_d6:8b:af (c4:43:8f:d6:8b:af), Dst: IPv4mcast_7f:ff:fa (01:00:5e:7f:ff:fa)
Internet Protocol Version 4, Src: 192.168.0.103 (192.168.0.103), Dst: 239.255.255.250 (239.255.255.250)
User Datagram Protocol, Src Port: 39805 (39805), Dst Port: 1900 (1900)
Hypertext Transfer Protocol

No.     Time           Source                Destination           Protocol Length Info
    128 30.585913000   204.79.197.200        192.168.0.101         TCP      54     443→50494 [RST, ACK] Seq=1 Ack=1 Win=0 Len=0

Frame 128: 54 bytes on wire (432 bits), 54 bytes captured (432 bits)
Ethernet II, Src: D-LinkIn_46:a3:e6 (bc:f6:85:46:a3:e6), Dst: HonHaiPr_01:2f:21 (2c:33:7a:01:2f:21)
Internet Protocol Version 4, Src: 204.79.197.200 (204.79.197.200), Dst: 192.168.0.101 (192.168.0.101)
Transmission Control Protocol, Src Port: 443 (443), Dst Port: 50494 (50494), Seq: 1, Ack: 1, Len: 0
